{
  "confidence": 0.9,
  "evidence": [
    {
      "digest": "b12a6034c6f00c69028eed41cf30e565a1aee08046661e1bf058a079f4b36788",
      "type": "trace_hash"
    }
  ],
  "expires_at": "2027-01-15T08:01:42Z",
  "issued_at": "2027-01-15T08:00:42Z",
  "message_type": "observation",
  "metadata": {
    "fixture": "valid-v0.1"
  },
  "observation_id": "d65c2840dba27e04543bea69affd0aee",
  "observation_type": "runtime.lifecycle",
  "observed_at": "2027-01-15T08:00:42Z",
  "observer": {
    "id": "runtime",
    "key_id": "v1",
    "trust_domain": "domain-runtime"
  },
  "protocol_version": "0.1",
  "scope": [
    "runtime:default"
  ],
  "sequence_number": 1,
  "severity": "low",
  "signature": {
    "algorithm": "ed25519",
    "value": "c5dacd3489ece9199afae404fe7cbd62211002ad7491f5b54c1c4a4c3c7decb3f01d38108590d023b9e1a242eddb48142e9922defbffd4e219a369514d648906"
  },
  "subject": {
    "id": "fixture-agent",
    "type": "agent"
  },
  "tenant": "shared"
}

